chapter,title,image,copy,choice_1,goto_1,choice_2,goto_2,choice_3,goto_3,choice_4,goto_4,choice_5,goto_5,choice_6,goto_6
,,,"Zaraz za pagórkiem na który wjechaliście droga skręca bardziej w prawo i w powoli dogasającym świetle dnia na tle zadrzewionej skarpy widzisz położony na niewielkim pagórku klasztor. Kamienna budowla kryta dachówką jest okolona dwumetrowym murem który sprawia solidne wrażenie. Z lewej strony widać wyższą bryłę świątyni a z prawej przylegające do nich budynki klasztorne. Dym sączy się z kominów a okolicę spowija przedwieczorna cisza. Znów chwile jedziecie pod górę aż do bramy w kamiennym murze. 

- Marcinie otwórz - krzyczy starsza z sióstr. Po chwili mała klapa we wrotach uchyla się. Widać fragment twarzy i lustrujące was oczy.

- To przyjaciele… pomogli nam w drodze. Po chwili szamotaniny z skoblami. Wrota otwiera wam na oścież wysoki kościsty staruszek o zmierzwionych siwych włosach i przenikliwych oczach. 

Wjeżdżacie na teren klasztoru, budynki macie po lewej a po prawej resztę placu okolonego kamiennym murem i kilka bezlistnych drzew. 

Starszy odźwierny zamyka wrota.  - Dziwnych przyjaciół zbieracie matko na gościńcu. Co wam się stało? Pyta gdy widzi stan w jakim wracają obie mniszki. Pomaga starszej zejść z kozła.
Zbierające się wokół was i wozu siostry i kilka dzieciaków patrzą na was z rezerwą. 
- Ludzie Komesa chcieli nam odebrać jedzenie które znalazłyśmy - stwierdza młodsza zsiadając z wozu. Ci ludzie …. Oni ich przegonili. Z pomiędzy zebranych ludzi wychodzi wysoka silnie zbudowana mniszka. Jej habit wykończony jest czarnymi pasami ale nawet gdyby była ubrana tak samo jak inne widać by było od razu że to ona podejmuje tu decyzje.
- Nie ma co robić zbiegowiska - pomóżcie rozładować wóz - ogląda ile przywiozły - dobrze komentuje pod nosem, potem zwraca  się do was - Zostaniecie u nas, zapraszam wieczerza zaraz będzie gotowa. Końmi ktoś się zajmie - tu rzuca spojrzenie kilku podrostkiem którzy już wiedzą że mają nowe bojowe zadanie. 

No chodźcie bo wystygnie - rzuca już przez ramię idąc zamaszystym krokiem w kierunku klasztoru. 

",,,,,,,,,,,,