chapter,title,image,copy,choice_1,goto_1,choice_2,goto_2,choice_3,goto_3,choice_4,goto_4,choice_5,goto_5,choice_6,goto_6
1,Przeprawa,,"- Cholera tędy też nie przejedziemy - Gawron odwrócił do was swoją bladą twarz, godną kogoś kto bez sądu powinien zawisnąć.
Jechaliście do tego promu by przebyć rzekę. Została po nim tylko ucięta lina smętnie zwisająca z pokrytego śniegiem kołka. Nie było wiatru. Cisza. Dookoła puszczały śniegi a rzeką bezszelestnie spływała kra. 
Jano, drugi z twoich towarzyszy, wielkolud który w waszym oddziale był za felczera wzruszył ramionami.
- Z tym promem... nie spodziewałem, że się uda. Wokół same spalone wsie, zniszczone młyny i nie orane od wielu lat pola. Nie ma co zwlekać. Może dalej uda się znaleźć przeprawę. Ruszajmy!",Przyglądam się moim towarzyszom. ,3,Rozglądam się po okolicy z siodła.,4,,,,,,,,
,,,"Gawron - blada poznaczona bliznami twarz okolona brudnymi czarnymi kędziorami wystającymi spod kaptura. Chudzielec w poszarpanej, znoszonej przeszywanicy, bandyta bez czci i wiary, a przy bliższym poznaniu tylko gorzej. Łypał teraz wąskimi, ciemnymi oczyma to na uciętą linę, to na drugi brzeg rzeki powtarzając pod nosem litanię siarczystych przekleństw. Pierwszy odwrócił wierzchowca i ruszył botnistą droga w zdłuż rzeki.
Jano uśmiechnął się. Tego potężnego spokojnego mężczyzny nic nie było w stanie wytrącić z równowagi. Poprawił wodze w dłoni, cmoknął kącikiem uśmiechniętych ust na wierzchowca po czym ruszył za Gawronem.",Nic tu po nas. Ruszam za Jano i Gawronem.,5,,,,,,,,,,
,,,"Brunatne plamy krajobrazu wyłaniają się spod topniejącego śniegu. Po lewej Beck, szeroka na 200 metrów rzeka w kolorze oblężniczej smoły z wolna niesie poszarpane tafle lodu. Po prawej, rozjeżdżona droga wijąca się wśród ośnieżonych krzaków i wyschniętych traw wystawiających czupryny na lekkie muśnięcia cieplejszego wiatru ze wschodu. Dalej, stromo wzbijająca się piaszczysta skarpa ukoronowana szeregiem bezlistnych drzew. Bliżej ciebie, przyglądasz się mocowaniu promu - lina jest przecięta równo - jak wszystko co mijaliście przez ostatnie tygodnie i to zostało zniszczone ręką człowieka. Twoi towarzysze ruszyli jeden za drugim prowadząc konie drogą.",Popędzam konia by dogonić towarzyszy.,5,,,,,,,,,,
,,,Konie postępują ostrożnie rozgniatając kopytami rozmoknięty trakt prowadzący wzdłuż brzegu i dookoła sterty gałęzi i połamanych drzew wyrzuconych przez Beck. Ciszę przerywa Gawron ostrzegawczo strzelając palcami. ,Rozglądam się.,6,Patrzę przed siebie.,7,,,,,,,,
,,,"Obsypana śniegiem okolica wydaje się być jeszcze pogrążona w zimowym letargu. Szlak za wami jest pusty dokąd wzrok sięga. Może i nie jesteście już na wojnie ale oczy dookoła głowy przydają się zawsze, a starych nawyków nie łatwo się pozbyć. Gawron skinął tylko lekko głową z aprobatą, pochwalając tym samym twoją ostrożność i bez słowa pokazuje żeby jechać dalej.",Objeżdżam stertę gałęzi.,7,,,,,,,,,,
,,,"Nie dalej jak na odległość strzału z łuku dostrzegasz na drodze niewielki wóz przechylony niewygodnie na lewą stronę i zaprzęgnięty w siwka namolnie rozgrzebujacego śnieg w poszukiwaniu zmarzniętej trawy. Przy wozie widzisz dwie kręcące się postacie odziane w jednolite długie ciemne szaty. Gawron tymczasem, przymróżywszy powieki bardziej niż zwykle, rozgląda się uważnie po okolicy.

Zobaczmy co nam droga przyniosła - powiedział pogodnie Jano kierując się w stronę wozu.
Nie spodziewałbym się niczego dobrego - dopowiedział Gawron sucho nie spuszczając wzroku z horyzontu i ruszył za nim.",Poprawiasz się w siodle i jedziesz z nimi.,8,,,,,,,,,,
,,,"Wóz stracił koło i oparł się na osi częściowo zagrzebanej w śniegu i ziemi. Dwie mniszki w ciemno-szarych habitach widząc was chowają się za unieruchomiony pojazd.   

Kiedy podjeżdżacie bliżej Jano woła:
- Hej! Może pomóc?
Jedna z kobiet wychyliła się ostrożnie z nad wozu. W ręku trzyma rusznicę celując w waszą stronę. Druga, młodsza, również chowając się za wozem, zaciska obie dłonie na trzonku prostej siekiery.
- Nie trzeba nam waszej pomocy! - krzyknęła właścicielka rusznicy - jedzcie swoją drogą i zostawcie nas w spokoju! Głos jej drży ale gotowa do strzału rusznica oparta o burtę wygląda poważnie.",Zatrzymuję konia w bezpiecznej odległości.,10,Nie zważając na ostrzeżenie podjeżdżam do kobiet. ,9,,,,,,,,
,,,"Wystrzał, chmura siwego dymu i krzyk. Głuche uderzenie i zatykający ból w piersi. Wypadając bezwładnie z siodła obserwujesz zbliżający się w twoim kierunku rozjeżdżony trakt. Ból zamienia się w ciemność. ",Wydaję ostatni oddech.,0,,,,,,,,,,
,,,"Cała trójka zatrzymała się. Gawron podniósł ręce z dala od ciała. Jano odwrócił konia bokiem. Zimowy krajobraz zastygł jeszcze bardziej w ciszy.   

- Nie mamy złych zamiarów, możemy Wam pomóc - krzyczysz.
- Poradzimy sobie, jedźcie z Jedynym - Głos kobiety uspokoił się jakby ale lufa broni nie zmieniła kierunku. 

- Jedźmy dalej, nie chcą naszej pomocy to nie - warknął Gawron po czym zawrócił koniem tak by przejechać łukiem dookoła wozu. Jano skinął kobiecie na pożegnanie i ruszył błotnistą drogą za nim.  

Ruszasz za towarzyszami. Jano ogląda się jeszcze za siebie. 
- Nie ma co się im dziwić, wy dwaj wyglądacie na obwiesi i dawno żeście balii z wodą nie widzieli - mruknął Gawron.",Zbywasz tą uwagę wyniosłym milczeniem.,12,Traktujesz Gawrona grubym słowem.,11,,,,,,,,
,,,"- Gawron ma racje nie wyglądamy najlepiej - Jano śmieje się głośno - My się jeszcze domyjemy ale jego gębą będą dzieci straszyć nawet jakby miesiąc w balii z octem siedział. Pierwszy z towarzyszy, nie odwracając się nawet, uniósł tylko dłoń dzieląc się z wami obelżywym gestem. Jano wybuchnął śmiechem, płosząc kilka wron z pobliskich drzew. ",Dorównuję tempem towarzyszom.,12,,,,,,,,,,
,,,"Konie brną z wolna rozmokniętym traktem. Krzyk mew wzbił się nad taflą rzeki. Na drodze przed wami, daleko, może kilometr, z rzadkiego bukowego lasu wychodzą ludzie. Idą pieszo drogą, która podąża ku wam. Z daleka już widać, że to zbrojni. 
Gawron odwraca się do was:
- Broń w pogotowiu, nie wiadomo kogo czarci nadali. 

Podjeżdżacie coraz bliżej. Zbrojnych jest sześciu i nie wyglądają na regularny oddział. Zarośnięci, brudni chudzielce kojarzący się z bezpańskimi kundlami szwendającymi się po ogołoconych polach. Możliwe, że tak samo niebezpieczni. Za pasami brudne pordzewiałe kordy bez pochew. Dwóch z nich dzierży w dłoniach licho wyglądające włócznie. Trzech ma hełmy.",Ktoście? - pytasz.,13,Mijacie ich w ciszy.,15,,,,,,,,
,,,"Maruderzy zatrzymują się na drodze - patrzą wrogo. Z grupy wysuwa się jeden... ten w przekrzywionym hełmie wziął się pod boki i mierzy Cię spojrzeniem: 

- My ze straży miejskiej od Kasztelana z Wurzen. Jesli pojedziecie dalej tą droga to tam traficie. 
- A wy kto?","- Żołnierze, wracamy z wojny. Jest w tym całym Wurzen jakaś karczma?",14,- Nie twoja sprawa pachołku! - Ruszasz dalej.,15,,,,,,,,
,,,"Wszystko w Wurzen i okolicy należy do Kasztelana - u niego dostaniecie spyrze, chlanie i kurwy - maruder uśmiechną się paskudnie okazując dumnie uzębiebnienie wybrakowane bardziej niż jego własny rynsztunek.

- To nie ma co jezyka strzępić na zimnie, w Wurzen już się nas doczekać nie mogą - odzywa się Gawron poczym objeżdża bandę zbrojnych.",Pełna miska i kubek choćby wodnistego piwa brzmi zachęcająco.,16,,,,,,,,,,
,,,"Wymieniacie się wrogimi spojrzeniami mijajc o odległosci paru lichych włuczni. Dłoń spoczywa lekko na rękojeści broni, uniwersalny znak nie wymagający ani jednego słowa. Jego dodatkowo zaletą jest, że tłumaczy się na wszystkie znane Ci bandyckie dialekty. 
Zbiry patrzą pożądliwie na wasze konie ale żaden nie ma dość odwagi żeby zaczepić trzech żołnierzy.",Konie pochrapując nerwowo omijają zbrojnych.,16,,,,,,,,,,
,,,"Kiedy ich mineliście znów zbili się w ciasna grupę. Jano odprowadza ich wzrokiem odwracając się miarowo w siodle po czym milcząco zwraca wzrok przed siebie. Jedziecie jeszcze dłuższą chwilę w stronę lasu. Gawron zaczyna nerwowo kręcić się w siodle.
- Nie chciały przecież… - mruczy patrząc na olbrzyma.  Jano nic nie odpowia tylko z pochmurnym czołem wlepia wzrok w drogę przed wami. Znów zapada cisza. Jedziecie tak chwile kiedy Gawron odwraca się do ciebie - No, jeszcze nam rusznicą groziły...","- Tak, jedźmy dalej.",17,- Kurwa mać! Wracamy.,18,,,,,,,,
,,,"Droga odbija lekko w prawo ku zadrzewionej skarpie. Rzeka po lewej oddala się od traktu ustępując miejsca ośnieżonym kępom traw i piaszczystym łachom. Sciana lasu zbliża się powoli w waszą stronę. Bezlistne drzewa sprawiają smutne wrażenie, a otaczająca was cisza przerywana jest monotonnym, miarowym stąpaniem koni. 
W oddali, gdzieś za Wami, słyszysz odgłos strzału. Spłoszone ptaki zrywają się z lamentem i wypełniają niebo nad wami. Jano patrzy z wyrzutem na Gawrona, który w niemej odpowiedzi wydyma tylko usta, splata ręce i wodzi wzrokiem zawieszonym gdzieś w oddali.",- Jedźmy dalej. Jestem zmęczony i chętnie posadziłbym dupę w ciepłej karczmie.,54,Zawracam w kierunku odgłosu strzału!,18,,,,,,,,
,,,"Zawracacie konie i kłusem podażacie w kierunku wozu, od którego echem niósł się dźwięk wystrzału. Kiedy podjeżdżacie bliżej dochodzi was kobiecy krzyk. Popędzasz konia do galopu, błoto i śnieg rozpryskują się pod kopytami twojego wierzchowca, a na twarzy czujesz drapiące iskry mroźnego wiatru. Obaj towarzysze wyjęli broń i galopują za tobą. Gawron klnie siarczyście jakby wykrzykiwał modlitwe do Jedynego. Kiedy wóz wyłania się zza skarpy widzicie jedną z kobiet leżąca bez przytomności, a drugą szarpaną przez oprycha. Reszta tłoczy się do okoła wózu szykując się do rabunku.",Nie tracąc rozpędu wjeżdzam galopem w zbrojnych.,19,Krzyczę - Puść ją psie! ,20,,,,,,,,
,,,"Wjeżdżajać z impetem w grupę tratujesz jednego z łotrów i już zamierzałeś się mieczem na drugiego kiedy widzisz, że Jano ubiegł cię udeżając go na wyskości obojczyka potężnym ciosem swojego miecza. Kiedy zawracasz konia widzisz, że trzech z bandytów leży na ziemi a reszta w popłochu ucieka przez wysokie krzaki w stronę piaszczystej skarpy.",Zawracam konia i gonię bandytów uciekających ku skarpie.,26,Zostaję przy wozie.,42,,,,,,,,
,,,My ludzie Kasztelana - syczy przez zacisnięte zęby jeden z drabów - pana na tych ziemiach i burmistrza Wurzen. To one złamały prawo!,- Milcz psie! Na nich!,19,"- Gówno mnie to obchodzi. Masz ją puścić, bo posmakujesz żelaza. ",21,,,,,,,,
,,,"- Wszystko w okolicy należy do Kasztelana - A one same, bez jego pozwolenia, szukały żywności!
- Kasztelan nie może nam tego zakazać - odezwala się zakonnica drżacym głosem zabarwionym gniewem.
- Kasztelan dowie się o tym! Zobaczycie! - szczeka herszt jednocześnie dając znak swoim ludziom, którzy niechetnie odstępują od wozu i pod osłoną wyszczerbionego oręża i bełkotliwych przekleństw z wolna ruszyli niesforną grupą w stronę skarpy. 
Bez słowa odprowadzacie ich wzrokiem jeszcze przez chwilę aż zostajecie sami z pobitymi kobietami i ich połamanym wozem.",Odwracam się w stronę wozu.,45,,,,,,,,,,
,,,Próbujesz odjechać ale czujesz kłujący ostro ból w plecach. Zgiąłeś się kurczowo w pół i wypadłeś z siodła tracąc czucie w nogach. Upadek wyjął Co z płóc oddech. Chwytając łapczywie za kępy zmrożonej trawy próbujesz odczołgać się ale kolejne sztychy włóczni przybijają twoje wyprężone plecy dokonując dzieła.,To nie tak miało się skonczyć...,0,,,,,,,,,,
,,,"Nie miał szans cofnąć włóczni na czas gdy naparłeś na niego wierzchowcem i mocno rąbnołeś od góry. Zasłonił pierwszy cios poświęcając dłoń z cześćią przedramienia, a drugim roztrzaskałeś mu głowę. Opadł bezwładnie na ziemię drgając w konwulsjach by po chwili znieruchomiec na zrytej ziemi.",Wracam do wozu i towarzyszy.,41,,,,,,,,,,
,,,Drab zdążył wyprowadzić cięcie pierwszy ale jego cios zatrzymał się na klindze twojego miecza i zjechał ze zgrzytem aż do jelca. Pchnąłeś z siłą i poczułeś jak miecz wbija się głeboko w jego pierś. Włócznik zaatakował znienacka z drugiej strony i ledwo odbiłeś jego włócznie wyrywając szybkim ruchem miecz z pierwszego.,Wjeżdżam koniem na włócznika.,23,Spinam konia by oddalić się i zaatakowac ponownie.,22,,,,,,,,
,,,Włucznia wbija się w pierś twojego wierzchowca ,Próbuję utrzymać się na wierzchowcu,28,Zsuwam się z siodła.,29,,,,,,,,
,,,"Bandyci uciekają przedzierając sie przez krzaki i przeskakując ponad butwiejącymi pniami powalonych drzew. Próbując dogonić ich konno omijasz przeszkody powoli zbliżając się do dwóch z nich. Słysząc za sobą tętent kopyt odwracają się ku tobie i nastawiają broń gotowi do walki. Jeden z nich nastroszył grot włoczni w twoim kierunku, drugi, ostrzegawczo zastawia się pordzewiałym kordem.",- Rzućcie broń!,27,Szarżuję na włócznika.,25,Szarżuję na bandyte z kordem.,24,,,,,,
,,,"Bandyci podbiegają do ciebie, a ten z włócznią dźga twojego konia w pierś. Koń staje dęba wydąjc z siebie głośny kwik. ",Próbuję utrzymać się na wierzchowcu,28,Zsuwam się z siodła.,29,,,,,,,,
,,,"Twój koń upadł niezgrabnie na bok przygniatając Ci nogę i słyszysz ohydne chrupnięcie dobiegające spod siodła. Koń wierzga próbujac się nieudolnie podnieść do pionu, a Ty krzyczysz z bólu. Chwytając się obalonego pnia oswobadzasz nogę i tempo patrzysz na białą kość przebijającą sie przez nogawice. Jeden z oprawców podchodzi do Ciebie i dźga włócznią gdy Ty niezgrabnie zasłaniasz się ręką ale on nie przestaje, raz, drugi, trzeci.
Twój krzyk zamiera zamieniając się w charkot.",Modlę się do Jedynego,0,,,,,,,,,,
,,,"W ostatinm momencie udaje Ci się zeskoczyć z upadającego konia, który ostro wierzgając odgradza Cię na moment od nadciągających przciwników. ",Korzystam z zamieszania i uciekam.,30,Jak tylko koń zejdzie z drogi atakuję z furią.,31,Omijasz krzak i starasz się zajść włócznika z prawej.,39,Stajesz w postawie obronnej.,32,,,,
,,,"Słyszysz za sobą odgłosy pogoni przedzierającej się przez ostre zarośla. Sporadyczne przekleństwa i ciężkie oddechy wydają się oddalać, a gdy wybiegasz na błotnisty trakt zauważasz, że poza swoim ciężkim, parującym oddechem nie słyszysz już kroków za plecami. Ciche parsknięcie twojego konia wyrywa cię z chwilowego stanu rozluźnienia. Kilkadziesiat kroków dalej, na trakcie, zauważąsz swojego wierzchowca, który o dziwo wyszedł z jadki bez ran i podążył za tobą.
- Poszczęściło się nam - Mówisz do niego już spokojnym głosem podchodząc.",Łapię za wodze i prowadzę konia drogą spowrotem do wozu.,41,,,,,,,,,,
,,,"Uderzasz na nich ale włócznik skutecznie wykorztystuje dystans broni atakując szybkim pchnięciem, które odbijasz w ostatninm momencie. Ciosu wyprowadzonego przez drugiego z oprychów jednak nie zauważasz. Tępy ból sprowadza Cią na ziemie gdzie wypluwasz garść zakrwawionych zębow przez rozoraną pordzewiałym kordem twarz. Czujesz ciężar przeciwnika przytłaczający Cię do mieniącago się czerwienią śniegu. Powietrze wypełnia się smrodem przetrawionego alkocholu, potu i strachu gdy drugi staje nad wami i metodycznie dźga cię w pierś. ",Wsłuchuję się w swój zanikający oddech.,0,,,,,,,,,,
,,,Przeciwnicy krok po kroku skracają dystans. Jak zawszone kundle kożystają z liczebnej przewagi by znaleźć luke w obronie. Najpierw zaatakował włócznik ale jesteś na to przygotowany.,Próbuję z całej siły ściąć włócznie.,34,Zbijam włócznie chcąc ją przechwycić.,40,,,,,,,,
,,Nie użyte. Ok gdzieś się machłem.,Jeszcze chwilę ale najwidoczniej lepiej zna teren po chwili znika ci i słyszysz tylko jak się oddala.,Wracasz,41,,,,,,,,,,
,,,"Włócznia pęka sypiąc drzazgami, a zaskoczony bandyta zostaje z tępym ułomkiem w ręku. Szybki sztych twojego miecza wymierzony w gardło jest tak niespodziewany, że nawet nie zdążył krzyknąć i bezradnie osuwa się na kolana próbując zatamować krew obiema rękami. Drugi próbował Cię flankować ale zatrzymał się z wahaniem orientując się, że został sam. Z konsternacją oblewającą jego bladą, nikczemną twarz cofna się o krok.",Doskakuję i tnę.,36,- Won psie!,35,,,,,,,,
,,,"Cofa się o kilka kroków ze strachem i niedowierzaniem w oczach. Niezgrabnie potyka się o kępę suchego wrotyczu gubiąc na ziemi zardzewiały kord wraz z resztkami godności i zrywaja się do panicznej ucieczki.
Obserwujesz go jeszcze przez kilka chwil stojąc nad parującym ciałem jego martwego toważysza. Ciche parsknięcie twojego konia wyrywa cię z chwilowego stanu rozluźnienia. O dziwo twój wierzchowiec wyszedł z jadki bez ran.
- Poszczęściło się nam - Mówisz do niego spokojnym głosem podchodząc.",- Wracajmy do wozu.,41,,,,,,,,,,
,,,"Krawędź twojego miecza dosięga jego barku i głęboko wcina się w ramię kiedy próbował odwrócić się do ucieczki. Siła uderzenia wytrąca go z równowagi i pada na ziemie z krzykiem. Z wykrzywioną bólem twarzą patrzy przerażony na uchodzącą z niego krew, którą nieudolnie próbuje zatamować. ",Dobijam go.,37,Odchodzę i wracam do wozu.,38,,,,,,,,
,,,Kiedy wbijasz mu sztych miecza w gardło wybałusza oczy. Nigdy nie zapomnisz wyrazu jego twarzy. Umiera z bulgotem krwi wylewającej się z ust.,Wracasz,41,,,,,,,,,,
,,,Odchodzisz ale słyszysz jeszcze chwile jęki konającego.,Wracasz,41,,,,,,,,,,
,,,"Doskakujesz do niego z boku - tego się nie spodziewał. Po twoim pierwszym trafionym dźgnięciu skulił się wypuszczając broń i padł na kolana z ciężkim sapnięciem. Następnym szybkim ciosem rąbiesz w odsłonięty kark prawie strącając głowę z jego ramion. Drugi z przeciwników próbował cię zachodzić ale widząc konającego kompana, zatrzymuje się w miejscu by oszacować swoje szanse na przeżycie następnych kilku chwil. ",Wyprowadzam szybki cios.,36,- Won pachołku! ,35,,,,,,,,
,,,Parujesz uderzenie a drugą ręką chwytasz włócznie i ciągniesz do siebie. Przeciwnik się tego nie spodziewa i traci równowagę a ty rąbiesz go w czoło. Na ziemi upada już martwy na twojej broni zostaje jego mózg i krew. Drugi z przeciwników krzyczy i ucieka. ,Gonisz go,44,Wracasz,41,,,,,,,,
,,,Wracasz do wozu prowadząc konia. Machasz towarzyszom. Jano kiwa głową.,Zatrzymujesz się przy wozie,42,,,,,,,,,,
,,,"Młodsza patrzy z lękiem na trupy i krew na gościńcu. Trzyma się przy wozie. Starsza zaczęła sprawdzać czy któryś przeżył.
Gawron schylił się by przeszukać najbliższego trupa.
-Zostaw to biedaki, tylko się ubrudzisz  - Jano rozgląda się po okolicy - Lepiej zbierajmy się z tej drogi.
Gawron wzdycha przeciągle ale zostawia trupy tam gdzie były. ",Pochowajmy ich. ,43,Trzeba się zbierać.,45,,,,,,,,
,,,- Ziemia jeszcze zmarznięta - nic tu po nas odzywa się Gawron.,Zbierajmy się ,45,,,,,,,,,,
,,,"Jeszcze chwilę ale najwidoczniej lepiej zna teren po chwili znika ci i słyszysz tylko jak się oddala.
Zostałeś sam. Chwilę szukałeś konia a potem... ",Wróciłeś do wozu,42,,,,,,,,,,
,,,"Młodsza kobieta wydaje się przestraszona. Starsza, podnosząc sie otrzepuje szaty z błota i śniegu. Patrzy na was spokojniejszym wzrokiem. 
- Źle was oceniłam. Dziękujemy, nie wiem co ludzie Kasztelana by z nami zrobili gdyby nie wy.",- Kim jest Kasztelan?,46,- Co tu robicie?,47,,,,,,,,
,,,Kasztelan rządzi w Wurzen - w czasie wojny zebrał kupę zbrojnych i maruderów. Mężczyzn nie ma więc nikt nie sprzeciwił się jego władzy. Jego ludzie zbierają resztki żywności po najbliższej okolicy bo głód. Uważa że wszystko w okolicy należy do niego … prawem silniejszego. Przynajmniej na tym brzegu rzeki. Musimy stąd jechać.,Macie matko rację.,48,,,,,,,,,,
,,,"Chciałyśmy trochę jedzenia do klasztoru przywieść. Wiele mamy gęba do wykarmienia, a Kasztelan i jego ludzie wszystko zagarniają dla siebie żeby mieć władzę nad tymi co głodują. Na wozie jest trochę zboża i jabłek co się udało nam w spalonej wsi nieopodal znaleźć. Musimy wracać do klasztoru. Lepiej się nie kręcić przy rzece po zmroku. ",Pewnie tak.,48,,,,,,,,,,
,,,"- Bez wozu daleko nie pociągniecie. Dalej pomóż mi - mruknął Jano. 
Złapał się za dolną krawędź i wraz z Gawronem  podnieśli wóz. Po chwili koło było już na miejscu wbiliście klin i dwukółka znów mogła jechać. Gawron kopnął jeszcze kilka razy w koło. Mruknął coś pod nosem o tandecie i siadł na konia. 

Jedźcie z nami do klasztoru - Kasztelan nie zostawi was w spokoju A tu okolica też nie dobra - Obie kobiety popatrzyły z widocznym strachem na drugi brzeg rzeki. Załadowały się na wóz i ruszyły. Wsiedliście na konie i zdążyliście za nimi.",Patrzysz na drugi brzeg rzeki.,49,Przyglądasz się kobietom.,50,Patrzysz na to co wiozą na wozie.,51,,,,,,
,,,Odległy brzeg wydaje się martwy. Widzisz go przez lekko zamglone powietrze.  Nie widać na nim łodzi rybackich ani dymów świadczących o tym że ktoś tam mieszka. Las po drugiej stronie  wydaje się cichy i zarazem pusty. ,Wzdrygasz się i dajesz koniu piętami.,53,,,,,,,,,,
,,, Starsza z sióstr powozi - jej twarz jest pobrużdżona zmarszczkami ogorzała i lekko zarumieniona od mrozu patrzy przed siebie z wyrazem determinacji. Lejce trzyma krzepko. Młodsza kiedy widzi że się jej przyglądasz odwraca spłoszona wzrok. Chyba nie przywykła do towarzystwa zbrojnych mężczyzn.,Opuszczasz wzrok.,53,,,,,,,,,,
,,,"Dwukółka podskakuje na wyboistej drodze. Jest tam kilka worków - wygląda na to że wiozą ziarno na mąkę i jabłka. 

- Sprawdźcie panie rzołnierzu - niczego nie ukrywamy jabłka i ziarno. Starsza wyczuła chyba twój wzrok.",Wzruszasz ramionami.,53,Dźgasz mieczem worek.,52,,,,,,,,
,,,"Z worka wysypuje się ziarno - młodsza z zakonnic próbuje bezskutecznie złapać wylatujące ziarno i patrzy na ciebie ze złością.  
-Lepsze to niż jak byśmy nic nie dowiozły- odzywa się starsza.",Chowasz miecz.,53,,,,,,,,,,
,,,"Droga skręca lekko ku skarpie po prawej. Rzeka cały czas jest po lewej ale oddalacie się od niej. Powoli dojeżdżacie do lasu. Drzewa bez liści sprawiają smutne wrażenie panuje cisza słychać tylko wolne monotonne człapanie kon i skrzyp wozu. Jeszcze chwile jedziecie przez bukowy las pogrążony w ciszy i  śniegu. Aż docieracie do rozstajów. Na środku stoi stary pochylony drogowskaz. Jedna z dróg ta w lewo biegnie dalej wzdłuż rzeki i prowadzi do Wurzen. Droga w prawo prowadzi w kierunku skarpy a potem do klasztoru. 
- Jedźcie z nami do klasztoru - W Wurzen nie będziecie dobrze przyjęci. ",Nie boimy się Kasztelana - jedźmy do Wurzen.,56,Może to i racja - jedźmy do Klasztoru.,58,,,,,,,,
,,,Jeszcze chwile jedziecie przez bukowy las pogrążony w ciszy i śniegu. Aż docieracie do rozstajów. Na środku stoi stary pochylony drogowskaz. Jedna z dróg ta w lewo biegnie dalej wzdłuż rzeki i prowadzi do Wurzen. Droga w prawo prowadzi w kierunku skarpy a potem do klasztoru. ,Skręcacie w lewo - do Wurzen,55,Skręcacie w prawo - do klasztoru.,57,,,,,,,,
,,,Skręcili do Wurzen/nie było rozlewu krwi.,,,,,,,,,,,,
,,,Skręcili do Wurzen/było mordobicie.,,,,,,,,,,,,
,,,"Droga wiedzie lekko pod górą w kierunku obniżającej się tu skarpy. Las dookoła pełen jest zwiędłych i suchych paproci, przykrytych śniegiem. Teren dalej obniża droga skręca w prawo i widać już położony na niewielkiej górce klasztor. Chwile jedziecie pod górę aż do bramy w kamiennym murze. Wrota są zawarte. Jano podjeżdża do wrót i szarpie za linę. Rozlega się odgłos dzwonu. Za chwile we wrotach otwiera się klapka i widać tam gębe jakiegoś starca - przygląda się wam mrużąc oczy: 
- Kto wy? I czego tu chcecie? 
-Wędrowcy - schronienia potrzebujemy i strawy. 
Staruszek przygląda się Wam po chwili odpowiada
-Nic z tego tu nie znajdziecie, odejdzcie, to dom boży i przytułek dla sierot nie miejsce dla takich jak Wy - i zamyka otwór. 
Patrzycie na siebie z konsternacją. 
-Niedługo będzie zmierzchać - Jano patrzy w górę - Nie ma co tu stać i marznąć - jedźmy do tego Wurzen.",Zawracasz na drogę do Wurzen. ,60,Hej! Otwóżcie do cholery! ,59,,,,,,,,
,,,"Droga wiedzie lekko pod górą w kierunku obniżającej się tu skarpy. Las dookoła pełen jest zwiędłych i suchych paproci, przykrytych śniegiem. Wóz skrzypi tocząc się ciężko. Kobiety na wozie wydają się u kresu wytrzymałości, siedzą skulone zbyt zmęczone by trwożnie się rozglądać. Jano jadąc przodem wypatruje przeszkód pod końskimi kopytami i lustruje drogę przed wami. Jadący za nim Gawron lustruje lewą stronę drogi a ty z przyzwyczajenie patrzysz w prawo i jako że jedziesz ostatni często spoglądasz w tył. Przecierasz czasem oczy ten dzień dał się wszystkim we znaki. 
","Jedziesz w ciszy. Chcesz już tylko dojechać do celu.
",62,Przedstawiasz się zakonnicom.,61,,,,,,,,
,,,"Stoisz tak jeszcze chwile, klniesz starca i klasztor ale nikt nie odpowiada. ",Zawracacie na drogę do Wurzen.,60,,,,,,,,,,
,,,Opis drogi doi wurzen,,,,,,,,,,,,
,,,"-Jestem Kusz.Ten duży to Jano - wywołany odwrócił się i skinął głową. Tego …. drugiego nazywamy Gawronem. 
Starsza odwróciła się do ciebie uśmiechnęła lekko - to jest siostra Lena, mnie nazywają Matką Raduszą. Dziękuję żeście nas nie zostawili Jedyny Was nam zesłał.

",Zamyślony tylko kiwasz głową.,62,,,,,,,,,,
